<?xml version='1.0' encoding='UTF-8'?>
<?xml-stylesheet media="screen"              title="Dictionary view"   href="../../giella-core/dicts/scripts/gt_dictionary_XXE.css"     type="text/css"?>
<?xml-stylesheet media="screen"              title="Hierarchical view" href="../../giella-core/dicts/scripts/gt_dictionary_XXE_alt.css" type="text/css" alternate="yes" ?>
<?xml-stylesheet media="print,tv,projection" title="Dictionary view"   href="../../giella-core/dicts/scripts/gt_dictionary.css"         type="text/css"?>
<?xml-stylesheet media="print,tv,projection" title="Hierarchical view" href="../../giella-core/dicts/scripts/gt_dictionary_alt.css"     type="text/css" alternate="yes" ?>
<!DOCTYPE r PUBLIC "-//DivvunGiellatekno//DTD Dictionaries//Multilingual" "../smamul.dtd">
<r xmlns:xhtml="http://www.w3.org/1999/xhtml" id="smamul" xml:lang="sma">
   <lics xmlns:xhtml="http://www.w3.org/1999/xhtml" xml:space="preserve"><lic xml:lang="en">
This code is made available under a Creative Commons Attribution license
<a>http://creativecommons.org/licenses/by/3.0/no/deed.en</a>.

You are free to copy, distribute and adapt the work, as long as you always give
proper attribution using the attribution text below.

For the full license text, see the link above.</lic><ref>Work by Giellatekno at UiT, Divvun at the Norwegian Saami Parliament,
          and members of the language communities. Source code
          available at <a>https://victorio.uit.no/langtech/trunk/</a>.</ref><sourcenote>
     THIS TEXT IS THE ORIGINAL SOURCE CODE. This is NOT a fully styled and
     published dictionary. As such it can and
     will contain unfinished entries, unpublished entries, entries with
     objectionable translations, etc. If you find any errors or want to add more
     words, download the file, edit it, and send it back to
     <a>mailto:feedback@divvun.no</a> and <a>mailto:giellatekno@hum.uit.no</a>.
     Please also note that the entries are not necessarily sorted,
     or could be wrongly sorted.
     </sourcenote></lics>
   <e usage="dict">
      <lg>
         <l pos="CC">gon</l>
      </lg>
      <mg>
         <l_ref>jïh_cc</l_ref>
         <tg xml:lang="nob">
            <re>om to som hører sammen</re>
            <t pos="CC">og</t>
            <xg>
               <x>Manne aadtjegh aahka gon aajjan luvnie vearadamme.</x>
               <xt>Jeg har nettopp vært hos bestemor og bestefar.</xt>
            </xg>
         </tg>
         <tg xml:lang="swe">
            <t pos="CC">och</t>
         </tg>
      </mg>
   </e>
   <e usage="dict">
      <lg>
         <l pos="CC">gonnoeh</l>
      </lg>
      <mg>
         <l_ref>jïh_cc</l_ref>
         <tg xml:lang="nob">
            <re>om to som hører sammen</re>
            <t pos="CC">og</t>
            <xg>
               <x>tjidtjie gonnoeh aehtjieh</x>
               <xt>mor og far</xt>
            </xg>
         </tg>
         <tg xml:lang="swe">
            <t pos="CC">och</t>
         </tg>
      </mg>
   </e>
   <e usage="dict">
      <lg>
         <l pos="CC">jallh</l>
      </lg>
      <mg>
         <l_ref>vuj_cc</l_ref>
         <tg xml:lang="nob">
            <t pos="CC">eller</t>
            <xg>
              <x>Gogkoe ij leah geajnoe, dagkoe hov maahta girtine jallh helikopterinie fealadidh.</x>
              <xt>Der det ikke er vei kan man reise med fly eller helikopter.</xt>
            </xg>
         </tg>
         <tg xml:lang="swe">
            <t pos="CC">eller</t>
         </tg>
      </mg>
   </e>
   <e usage="dict">
      <lg>
         <l pos="CC">jïh</l>
      </lg>
      <mg>
         <tg xml:lang="nob">
            <t pos="CC">og</t>
            <xg>
               <x>Dovne Pöövle jïh Laara ligan desnie.</x>
               <xt>Både Paul og Lars var der.</xt>
            </xg>
         </tg>
         <tg xml:lang="swe">
            <t pos="CC">og_SWE</t>
         </tg>
      </mg>
   </e>
   <e usage="dict">
      <lg>
         <l pos="CC">men</l>
      </lg>
      <mg>
         <tg xml:lang="nob">
            <t pos="CC">men</t>
         </tg>
         <tg xml:lang="swe">
            <t pos="CC">men_SWE</t>
         </tg>
      </mg>
   </e>
   <e usage="dict">
      <lg>
         <l pos="CC">mohte</l>
      </lg>
      <mg>
         <tg xml:lang="nob">
            <t pos="CC">men</t>
            <xg>
               <x>Sliehtie-elmie, mohte tjaktje hov lea.</x>
               <xt>Det er ruskevær med sludd, men så er det jo høst.</xt>
            </xg>
            <xg>
               <x>Dïhte geajnoe dahkoe lea dan siegkie, mohte dïhte mubpie geajnoe sagki buerebe.</x>
               <xt>Den veien dit er så smal, men den andre veien er mye bedre.</xt>
            </xg>
         </tg>
         <tg xml:lang="swe">
            <t pos="CC">men_SWE</t>
         </tg>
      </mg>
   </e>
   <e usage="dict">
      <lg>
         <l pos="CC">vïj</l>
      </lg>
      <mg>
         <l_ref>jallh_cc</l_ref>
         <tg xml:lang="nob">
            <re>i spørsmål om to alternativer</re>
            <t pos="CC">eller</t>
         </tg>
         <tg xml:lang="swe">
            <re>i spørsmål om to_SWE</re>
            <t pos="CC">eller_SWE</t>
         </tg>
      </mg>
   </e>
   <e usage="dict">
      <lg>
         <l pos="CC">vuj</l>
      </lg>
      <mg>
         <l_ref>jallh_cc</l_ref>
         <tg xml:lang="nob">
            <re>i spørsmål om to alternativer</re>
            <t pos="CC">eller</t>
            <xg>
               <x>Mejtie tseagkoeh gåetie vuj slapmoeh gåetie?</x>
               <xt>Er det en opprettstående kåte eller en lav og vid kåte?</xt>
            </xg>
         </tg>
         <tg xml:lang="swe">
            <re>i spørsmål om to_SWE</re>
            <t pos="CC">eller_SWE</t>
         </tg>
      </mg>
   </e>
   <xhtml:script xmlns:xhtml="http://www.w3.org/1999/xhtml" src="../../giella-core/dicts/scripts/gt_dictionary.js" type="text/javascript"/>
</r>
