<?xml version='1.0' encoding='UTF-8'?>
<?xml-stylesheet media="screen"              title="Dictionary view"   href="../../giella-core/dicts/scripts/gt_dictionary_XXE.css"     type="text/css"?>
<?xml-stylesheet media="screen"              title="Hierarchical view" href="../../giella-core/dicts/scripts/gt_dictionary_XXE_alt.css" type="text/css" alternate="yes" ?>
<?xml-stylesheet media="print,tv,projection" title="Dictionary view"   href="../../giella-core/dicts/scripts/gt_dictionary.css"         type="text/css"?>
<?xml-stylesheet media="print,tv,projection" title="Hierarchical view" href="../../giella-core/dicts/scripts/gt_dictionary_alt.css"     type="text/css" alternate="yes" ?>
<!DOCTYPE r PUBLIC "-//DivvunGiellatekno//DTD Dictionaries//Multilingual" "../dtd/smamul.dtd">
<r xmlns:xhtml="http://www.w3.org/1999/xhtml" id="smamul" xml:lang="sma">
   <lics xmlns:xhtml="http://www.w3.org/1999/xhtml" xml:space="preserve"><lic xml:lang="en">
This code is made available under a Creative Commons Attribution license
<a>http://creativecommons.org/licenses/by/3.0/no/deed.en</a>.

You are free to copy, distribute and adapt the work, as long as you always give
proper attribution using the attribution text below.

For the full license text, see the link above.</lic><ref>Work by Giellatekno at UiT, Divvun at the Norwegian Saami Parliament,
          and members of the language communities. Source code
          available at <a>https://victorio.uit.no/langtech/trunk/</a>.</ref><sourcenote>
     THIS TEXT IS THE ORIGINAL SOURCE CODE. This is NOT a fully styled and
     published dictionary. As such it can and
     will contain unfinished entries, unpublished entries, entries with
     objectionable translations, etc. If you find any errors or want to add more
     words, download the file, edit it, and send it back to
     <a>mailto:feedback@divvun.no</a> and <a>mailto:giellatekno@hum.uit.no</a>.
     Please also note that the entries are not necessarily sorted,
     or could be wrongly sorted.
     </sourcenote></lics>
   <e>
      <lg>
         <l pos="Pron" type="Recipr">sinsitniem</l>
         <analysis>Pron_Recipr_Acc</analysis>
         <mini_paradigm>
            <analysis ms="Pron_Recipr_Gen">
               <wordform>sinsitnien</wordform>
            </analysis>
            <analysis ms="Pron_Recipr_Ill">
               <wordform>sinsætnan</wordform>
            </analysis>
            <analysis ms="Pron_Recipr_Ela">
               <wordform>sinsitneste</wordform>
            </analysis>
            <analysis ms="Pron_Recipr_Com">
               <wordform>sinsitnine</wordform>
            </analysis>
         </mini_paradigm>
      </lg>
      <mg>
         <tg xml:lang="nob">
            <t pos="Pron">hverandre</t>
            <xg>
               <x>Såemies laantesne almetjh sinsitniem bovvehtjeminie.</x>
               <xt>I noen land holder folk på å drepe hverandre.</xt>
            </xg>
         </tg>
         <tg xml:lang="swe">
            <t pos="Pron">varandra_SWE_OC</t>
            <xg>
               <x>Såemies laantesne almetjh sinsitniem bovvehtjeminie.</x>
               <xt>I vissa länder håller människor på att döda varandra.</xt>
            </xg>
         </tg>
      </mg>
   </e>
   <e>
      <lg>
         <l pos="Pron" type="Recipr">sinsitnien</l>
         <lemma_ref lemmaID="sinsitniem_pron_recipr">sinsitniem</lemma_ref>
         <analysis>Pron_Recipr_Gen</analysis>
      </lg>
      <mg>
         <tg xml:lang="nob">
            <t pos="Pron">hverandres</t>
            <t pos="Pron">hverandre</t>
            <xg>
               <x>Gabte geajnoeh daerpies, guktie göökte bïjlh maehtieh gaavnedidh jïh sinsitnien baaktoe baahtsedh.</x>
               <xt>En bred vei er nødvendig, slik at to biler kan møtes og komme forbi hverandre.</xt>
            </xg>
            <xg>
               <x>Sinsitnien juelkide bïssin.</x>
               <xt>De vasket hverandres føtter.</xt>
            </xg>
         </tg>
         <tg xml:lang="swe">
            <t pos="Pron">varandras_SWE_OC</t>
            <xg>
               <x>Gabte geajnoeh daerpies, guktie göökte bïjlh maehtieh gaavnedidh jïh sinsitnien baaktoe baahtsedh.</x>
               <xt>En bred väg är nödvändig så att två bilar kan mötas och passera varandra.</xt>
            </xg>
            <xg>
               <x>Sinsitnien juelkide bïssin.</x>
               <xt>De tvättade varandras fötter.</xt>
            </xg>
         </tg>
      </mg>
   </e>
   <e>
      <lg>
         <l pos="Pron" type="Recipr">sinsætnan</l>
         <lemma_ref lemmaID="sinsitniem_pron_recipr">sinsitniem</lemma_ref>
         <analysis>Pron_Recipr_Ill</analysis>
      </lg>
      <mg>
         <tg xml:lang="nob">
            <t pos="Pron">til hverandre</t>
            <xg>
               <x>Almetjh hov maehtieh sinsætnan soptsestidh gogkoe dam tjuerieh vaedtsedh.</x>
               <xt>Folk kan jo fortelle til hverandre hvor de skal gå.</xt>
            </xg>
            <xg>
               <x>Ålma jïh gåmmebe sinsætnan vuartasjægan.</x>
               <xt>Mannen og kona så på hverandre.</xt>
            </xg>
         </tg>
         <tg xml:lang="swe">
            <t pos="Pron">till varandra_SWE_OC</t>
            <xg>
               <x>Almetjh hov maehtieh sinsætnan soptsestidh gogkoe dam tjuerieh vaedtsedh.</x>
               <xt>Människor kan ju berätta för varandra vart de ska gå.</xt>
            </xg>
            <xg>
               <x>Ålma jïh gåmmebe sinsætnan vuartasjægan.</x>
               <xt>Mannen och kvinnan såg på varandra.</xt>
            </xg>
         </tg>
      </mg>
   </e>
   <e>
      <lg>
         <l pos="Pron" type="Recipr">sinsitneste</l>
         <lemma_ref lemmaID="sinsitniem_pron_recipr">sinsitniem</lemma_ref>
         <analysis>Pron_Recipr_Ela</analysis>
      </lg>
      <mg>
         <tg xml:lang="nob">
            <t pos="Pron">fra hverandre</t>
            <xg>
               <x>Luste almetjidie åadtjodh gaavnedidh, sinsitneste saernieh govledh.</x>
               <xt>Det er artig for folk å treffes for å høre nytt fra hverandre.</xt>
            </xg>
            <xg>
               <x>Guhkiem ligan sinsitneste orreme, mohte gieriesvoete lij læjhkan seamma nænnoes.</x>
               <xt>De to hadde vært lenge borte fra hverandre, men kjærligheten var likevel like sterk.</xt>
            </xg>
         </tg>
         <tg xml:lang="swe">
            <t pos="Pron">från varandra_SWE_OC</t>
            <xg>
               <x>Luste almetjidie åadtjodh gaavnedidh, sinsitneste saernieh govledh.</x>
               <xt>Det är roligt för folk att träffas för att höra nyheter från varandra.</xt>
            </xg>
            <xg>
               <x>Guhkiem ligan sinsitneste orreme, mohte gieriesvoete lij læjhkan seamma nænnoes.</x>
               <xt>De två hade varit borta från varandra länge, men kärleken var ändå lika stark.</xt>
            </xg>
         </tg>
      </mg>
   </e>
   <e>
      <lg>
         <l pos="Pron" type="Recipr">sinsitnine</l>
         <lemma_ref lemmaID="sinsitniem_pron_recipr">sinsitniem</lemma_ref>
         <analysis>Pron_Recipr_Com</analysis>
      </lg>
      <mg>
         <tg xml:lang="nob">
            <t pos="Pron">med hverandre</t>
            <xg>
               <x>Almetjh tjoeverieh åadtjodh gaavnedidh, sinsitnine åahpenidh.</x>
               <xt>Folk må få møtes, for å bli kjent med hverandre.</xt>
            </xg>
         </tg>
         <tg xml:lang="swe">
            <t pos="Pron">med varandra_SWE_OC</t>
            <xg>
               <x>Almetjh tjoeverieh åadtjodh gaavnedidh, sinsitnine åahpenidh.</x>
               <xt>Folk måste få träffas för att lära känna varandra.</xt>
            </xg>
         </tg>
      </mg>
   </e>
   <xhtml:script xmlns:xhtml="http://www.w3.org/1999/xhtml" src="../../giella-core/dicts/scripts/gt_dictionary.js" type="text/javascript"/>
</r>
