<?xml version="1.0" encoding="UTF-8"?>
<?xml-stylesheet media="screen"              title="Dictionary view"   href="../../giella-core/dicts/scripts/gt_dictionary_XXE.css"     type="text/css"?>
<?xml-stylesheet media="screen"              title="Hierarchical view" href="../../giella-core/dicts/scripts/gt_dictionary_XXE_alt.css" type="text/css" alternate="yes" ?>
<?xml-stylesheet media="print,tv,projection" title="Dictionary view"   href="../../giella-core/dicts/scripts/gt_dictionary.css"         type="text/css"?>
<?xml-stylesheet media="print,tv,projection" title="Hierarchical view" href="../../giella-core/dicts/scripts/gt_dictionary_alt.css"     type="text/css" alternate="yes" ?>
<!--
<!DOCTYPE r PUBLIC "-//DivvunGiellatekno//DTD Dictionaries//Multilingual" "../dtd/smamul.dtd">
-->
<!DOCTYPE r PUBLIC "-//DivvunGiellatekno//DTD Dictionaries//Multilingual"
"../dtd/smamul.dtd">

<r id="smamul" xml:lang="sma">
   <lics xml:space="preserve">
      <lic xml:lang="en">
This code is made available under a Creative Commons Attribution license
<a>http://creativecommons.org/licenses/by/3.0/no/deed.en</a>.

You are free to copy, distribute and adapt the work, as long as you always give
proper attribution using the attribution text below.

For the full license text, see the link above.</lic>
      <ref>Work by Giellatekno at UiT, Divvun at the Norwegian Saami Parliament,
          and members of the language communities. Source code
          available at <a>https://victorio.uit.no/langtech/trunk/</a>.</ref>
      <sourcenote>
     THIS TEXT IS THE ORIGINAL SOURCE CODE. This is NOT a fully styled and
     published dictionary. As such it can and
     will contain unfinished entries, unpublished entries, entries with
     objectionable translations, etc. If you find any errors or want to add more
     words, download the file, edit it, and send it back to
     <a>mailto:feedback@divvun.no</a> and <a>mailto:giellatekno@hum.uit.no</a>.
     Please also note that the entries are not necessarily sorted,
     or could be wrongly sorted.
     </sourcenote>
   </lics>
   <e src="sk" usage="dict">
      <lg>
         <l pos="N" type="Prop" nr="Pl" sem_type="Plc">Njuanajaevrieh</l>
      </lg>
      <mg>
         <tg xml:lang="nob">
            <re>Rindal</re>
            <t pos="N" type="Prop">Tangvatna</t>
         </tg>
      </mg>
   </e>
   <e src="sk" usage="dict">
      <lg>
         <l pos="N" type="Prop" nr="Pl" sem_type="Plc">Tjohkeleh</l>
      </lg>
      <mg>
         <tg xml:lang="nob">
            <re>Selbu</re>
            <t pos="N" type="Prop">Skarvan</t>
         </tg>
      </mg>
   </e>
   <e src="sk" usage="dict">
      <lg>
         <l pos="N" type="Prop" nr="Pl" sem_type="Plc">Faatnajabpejaevrieh</l>
      </lg>
      <mg>
         <tg xml:lang="nob">
            <re>Tydal</re>
            <t pos="N" type="Prop">Skreddarsjøane</t>
         </tg>
      </mg>
   </e>
   <e src="sk" usage="dict">
      <lg>
         <l pos="N" type="Prop" nr="Pl" sem_type="Plc">Bealjehkh</l>
      </lg>
      <mg>
         <tg xml:lang="nob">
            <re>Tydal</re>
            <t pos="N" type="Prop">Sylan</t>
         </tg>
      </mg>
   </e>
   <e src="sk" usage="dict">
      <lg>
         <l pos="N" type="Prop" nr="Pl" sem_type="Plc">Pliehkiejaevrieh</l>
      </lg>
      <mg>
         <tg xml:lang="nob">
            <re>Meråker</re>
            <t pos="N" type="Prop">Lødøljsjøan</t>
         </tg>
      </mg>
   </e>
   <e src="sk" usage="dict">
      <lg>
         <l pos="N" type="Prop" nr="Pl" sem_type="Plc">Saedtietjaerhvieh</l>
      </lg>
      <mg>
         <tg xml:lang="nob">
            <re>Nordli</re>
            <t pos="N" type="Prop">Grønflatknulen</t>
         </tg>
      </mg>
   </e>
   <e src="sk" usage="dict">
      <lg>
         <l pos="N" type="Prop" nr="Pl" sem_type="Plc">Aahkabieljieh</l>
      </lg>
      <mg>
         <tg xml:lang="nob">
            <re>Nordli</re>
            <t pos="N" type="Prop">Akkavassøran</t>
         </tg>
      </mg>
   </e>
   <e src="sk" usage="dict">
      <lg>
         <l pos="N" type="Prop" nr="Pl" sem_type="Plc">Guelehtsjaevrieh</l>
      </lg>
      <mg>
         <tg xml:lang="nob">
            <re>Nordli</re>
            <t pos="N" type="Prop">Fiskløysvatna</t>
         </tg>
      </mg>
   </e>
   <e src="sk" usage="dict">
      <lg>
         <l pos="N" type="Prop" nr="Pl" sem_type="Plc">Golmesjaevrieh</l>
      </lg>
      <mg>
         <tg xml:lang="nob">
            <re>Røyrvik</re>
            <t pos="N" type="Prop">Storgollomsvatnet</t>
         </tg>
      </mg>
   </e>
   <e src="sk" usage="dict">
      <lg>
         <l pos="N" type="Prop" nr="Pl" sem_type="Plc">Gåetbielesdurrienjaevrieh</l>
      </lg>
      <mg>
         <tg xml:lang="nob">
            <re>Røyrvik</re>
            <t pos="N" type="Prop">Husviktjønnin</t>
         </tg>
      </mg>
   </e>
   <e src="sk" usage="dict">
      <lg>
         <l pos="N" type="Prop" nr="Pl" sem_type="Plc">Tjaeksienjaevrieh</l>
      </lg>
      <mg>
         <tg xml:lang="nob">
            <re>Røyrvik</re>
            <t pos="N" type="Prop">Renselskardtjønnin</t>
         </tg>
      </mg>
   </e>
   <e src="sk" usage="dict">
      <lg>
         <l pos="N" type="Prop" nr="Pl" sem_type="Plc">Måarenjaevrieh</l>
      </lg>
      <mg>
         <tg xml:lang="nob">
            <re>Røyrvik</re>
            <t pos="N" type="Prop">Beinvatna</t>
         </tg>
      </mg>
   </e>
   <e src="sk" usage="dict">
      <lg>
         <l pos="N" type="Prop" nr="Pl" sem_type="Plc">Tjiermejaevrieh</l>
      </lg>
      <mg>
         <tg xml:lang="nob">
            <re>Røyrvik</re>
            <t pos="N" type="Prop">Tjermavatna</t>
         </tg>
      </mg>
   </e>
   <e src="sk" usage="dict">
      <lg>
         <l pos="N" type="Prop" nr="Pl" sem_type="Plc">Jassehkentjonneh</l>
      </lg>
      <mg>
         <tg xml:lang="nob">
            <re>Røyrvik</re>
            <t pos="N" type="Prop">Jassånilstjønnin</t>
         </tg>
      </mg>
   </e>
   <e src="sk" usage="dict">
      <lg>
         <l pos="N" type="Prop" nr="Pl" sem_type="Plc">Sieteretjonneh</l>
      </lg>
      <mg>
         <tg xml:lang="nob">
            <re>Namsskogan</re>
            <t pos="N" type="Prop">Sætertjørnin</t>
         </tg>
      </mg>
   </e>
   <e src="sk" usage="dict">
      <lg>
         <l pos="N" type="Prop" nr="Pl" sem_type="Plc">Guhkiestjonneh</l>
      </lg>
      <mg>
         <tg xml:lang="nob">
            <re>Namsskogan</re>
            <t pos="N" type="Prop">Langtjønna</t>
         </tg>
      </mg>
   </e>
   <e src="sk" usage="dict">
      <lg>
         <l pos="N" type="Prop" nr="Pl" sem_type="Plc">Jahtedh</l>
      </lg>
      <mg>
         <tg xml:lang="nob">
            <re>Høylandet</re>
            <t pos="N" type="Prop">Finntroppin</t>
         </tg>
      </mg>
   </e>
   <e src="sk" usage="dict">
      <lg>
         <l pos="N" type="Prop" nr="Pl" sem_type="Plc">Snuvrejaevrieh</l>
      </lg>
      <mg>
         <tg xml:lang="nob">
            <re>Høylandet</re>
            <t pos="N" type="Prop">Årkverntjørnin</t>
         </tg>
      </mg>
   </e>
   <e src="sk" usage="dict">
      <lg>
         <l pos="N" type="Prop" nr="Pl" sem_type="Plc">Gaelpientjonneh</l>
      </lg>
      <mg>
         <tg xml:lang="nob">
            <re>Nordbindalen</re>
            <t pos="N" type="Prop">Nilsinetjørnin</t>
         </tg>
      </mg>
   </e>
   <e src="sk" usage="dict">
      <lg>
         <l pos="N" type="Prop" nr="Pl" sem_type="Plc">Gaelpienjaevrieh</l>
      </lg>
      <mg>
         <tg xml:lang="nob">
            <re>Nordbindalen</re>
            <t pos="N" type="Prop">Nilsinetjørnin</t>
         </tg>
      </mg>
   </e>
   <e src="sk" usage="dict">
      <lg>
         <l pos="N" type="Prop" nr="Pl" sem_type="Plc">Grovhtemehkienjaevrieh</l>
      </lg>
      <mg>
         <tg xml:lang="nob">
            <re>Nordbindalen</re>
            <t pos="N" type="Prop">Grytendalsvatnan</t>
         </tg>
      </mg>
   </e>
   <e src="sk" usage="dict">
      <lg>
         <l pos="N" type="Prop" nr="Pl" sem_type="Plc">Bueleksjællanjaevrieh</l>
      </lg>
      <mg>
         <tg xml:lang="nob">
            <re>Nordbindalen</re>
            <t pos="N" type="Prop">Nilsfinntjønnin</t>
         </tg>
      </mg>
   </e>
   <e src="sk" usage="dict">
      <lg>
         <l pos="N" type="Prop" nr="Pl" sem_type="Plc">Giedtiejaevrieh</l>
      </lg>
      <mg>
         <tg xml:lang="nob">
            <re>Hattfjelldal</re>
            <t pos="N" type="Prop">Sætertjønnan</t>
         </tg>
      </mg>
   </e>
   <e src="sk" usage="dict">
      <lg>
         <l pos="N" type="Prop" nr="Pl" sem_type="Plc">Pingkelejaavretjh</l>
      </lg>
      <mg>
         <tg xml:lang="nob">
            <re>Hattfjelldal</re>
            <t pos="N" type="Prop">Pinkelvatnan</t>
         </tg>
      </mg>
   </e>
   <e src="sk" usage="dict">
      <lg>
         <l pos="N" type="Prop" nr="Pl" sem_type="Plc">Gaajsetjenjaevrieh</l>
      </lg>
      <mg>
         <tg xml:lang="nob">
            <re>Mo</re>
            <t pos="N" type="Prop">Jordbekkvatnan</t>
         </tg>
      </mg>
   </e>
   <e src="sk" usage="dict">
      <lg>
         <l pos="N" type="Prop" nr="Pl" sem_type="Plc">Plierehkejaevrieh</l>
      </lg>
      <mg>
         <tg xml:lang="nob">
            <re>Mo</re>
            <t pos="N" type="Prop">Blerekvatnan</t>
         </tg>
      </mg>
   </e>
   <e src="sk" usage="dict">
      <lg>
         <l pos="N" type="Prop" nr="Pl" sem_type="Plc">Gaajsetjh</l>
      </lg>
      <mg>
         <tg xml:lang="nob">
            <re>Mo</re>
            <t pos="N" type="Prop">Småtindan</t>
         </tg>
      </mg>
   </e>
   <xhtml:script xmlns:xhtml="http://www.w3.org/1999/xhtml" src="../../giella-core/dicts/scripts/gt_dictionary.js" type="text/javascript"/>
</r>
